{"schemaVersion":"v01-localapi-fixture/v0.1","fixtureId":"localapi-valid-withdrawn-harness-approval-not-actionable","category":"valid","requirementRefs":["G4-08A-LIFECYCLE-01","C03-APPROVAL-LIFECYCLE-01"],"principal":{"kind":"FOUNDER","principalId":"os-user:founder","authenticated":true},"transport":{"kind":"WINDOWS_NAMED_PIPE"},"startingState":{"adapterRequest":{"approvalRequestId":"approval-001","requestLifecycle":"APPROVAL_REQUEST_LIFECYCLE_KIND_WITHDRAWN","requestRevision":2}},"operation":{"getHarnessApprovalView":{"approvalRequestId":"approval-001"}},"expected":{"outcome":"ok","businessWriteCount":0,"adapterRequestSourcePreserved":true,"policyDecisionSourcePreserved":true,"unifiedAuthorityStateInvented":false,"nativeRoutingExposed":false,"actionable":false,"availableActionsCount":0,"policyAuthorityCallCount":0}}
