{"schemaVersion":"v01-localapi-fixture/v0.1","fixtureId":"localapi-valid-cli-desktop-same-position","category":"valid","requirementRefs":["AC-08","C07-SURFACE-01","QA-05"],"principal":{"kind":"FOUNDER","principalId":"os-user:founder","authenticated":true},"transport":{"kind":"WINDOWS_NAMED_PIPE"},"startingState":{"projectionEpoch":"epoch_01","projectionSequence":60},"operation":{"getTaskView":{"taskId":"task_01","surfaces":["CLIENT_SURFACE_DESKTOP","CLIENT_SURFACE_CLI"]}},"expected":{"outcome":"ok","businessWriteCount":0,"sameSerializedBusinessFields":true,"sameProjectionPosition":true,"surfaceSpecificStatusMapping":false}}
