{"schemaVersion":"v01-localapi-fixture/v0.1","fixtureId":"localapi-valid-watch-harness-approval-complete-snapshots","category":"valid","requirementRefs":["G4-08A-STREAM-01","C07-STREAM-03"],"principal":{"kind":"FOUNDER","principalId":"os-user:founder","authenticated":true},"transport":{"kind":"WINDOWS_NAMED_PIPE"},"startingState":{"resumeAfter":{"epoch":"epoch_01","sequence":81}},"operation":{"watchHarnessApprovalViews":{"resumeAfter":{"epoch":"epoch_01","sequence":81},"actionableOnly":true}},"expected":{"outcome":"ok","businessWriteCount":0,"completeSnapshot":true,"fieldPatch":false,"delivery":"at_least_once","orderedWithinEpoch":true}}
