{"schemaVersion":"v01-localapi-fixture/v0.1","fixtureId":"localapi-unauthorized-other-os-user","category":"unauthorized","requirementRefs":["C07-AUTH-02"],"principal":{"kind":"OTHER_OS_USER","principalId":"os-user:other","authenticated":true},"transport":{"kind":"WINDOWS_NAMED_PIPE","peerCredentialVerified":true,"aclCurrentUserOnly":true},"startingState":null,"operation":{"openSession":{"surface":"CLIENT_SURFACE_CLI","supportedContractVersions":["1.0"]}},"expected":{"outcome":"error","businessWriteCount":0,"errorCode":"LOCAL_API_ERROR_CODE_PERMISSION_DENIED","sessionCreated":false}}
