{"schemaVersion":"v01-localapi-fixture/v0.1","fixtureId":"localapi-valid-tui-same-kernel-command","category":"valid","requirementRefs":["C07-KERNEL-01","AC-10"],"principal":{"kind":"FOUNDER","principalId":"os-user:founder","authenticated":true},"transport":{"kind":"WINDOWS_NAMED_PIPE","peerCredentialVerified":true},"startingState":{"surface":"CLIENT_SURFACE_TUI","principalPolicyRef":"policy_founder_v1","taskRevision":5},"operation":{"executeTaskCommand":{"command":"requestTaskCancellation","commandId":"cmd_tui_cancel_01","requestDigest":"eeeeeeeeeeeeeeeeeeeeeeeeeeeeeeeeeeeeeeeeeeeeeeeeeeeeeeeeeeeeeeee"}},"expected":{"outcome":"ok","businessWriteCount":1,"writeOwner":"TaskAuthority","projectionAwaitTokenCreated":true,"projectedViewReturnedAsCurrent":false,"localApiFactWritten":false,"sameClientKernelContractAsCliDesktop":true,"samePrincipalCapabilitiesAcrossSurfaces":true,"presentationSurfaceAffectedAuthorization":false}}
