{"schemaVersion":"v01-localapi-fixture/v0.1","fixtureId":"localapi-unauthorized-model-harness-approval","category":"unauthorized","requirementRefs":["C07-AUTH-03","G4-07A-AUTH-02"],"principal":{"kind":"MODEL","principalId":"model:codex","authenticated":true},"transport":{"kind":"WINDOWS_NAMED_PIPE","peerCredentialVerified":true},"startingState":{"surface":"CLIENT_SURFACE_CLI","approvalRequestId":"approval-001"},"operation":{"decideHarnessApproval":{"approvalRequestId":"approval-001","expectedActionDigestSha256":"e3e3e3e3e3e3e3e3e3e3e3e3e3e3e3e3e3e3e3e3e3e3e3e3e3e3e3e3e3e3e3e3","expectedRequestObservationId":"observation-approval-001","expectedRequestObservationSequence":12,"decision":"APPROVAL_DECISION_ALLOW_ONCE","reasonCode":"MODEL_SELF_APPROVAL"}},"expected":{"outcome":"error","businessWriteCount":0,"errorCode":"LOCAL_API_ERROR_CODE_PERMISSION_DENIED","authorityCallCount":0,"founderDelegationInferred":false}}
