{"schemaVersion":"v01-localapi-fixture/v0.1","fixtureId":"localapi-valid-task-command-authority-result","category":"valid","requirementRefs":["C07-CMD-01"],"principal":{"kind":"FOUNDER","principalId":"os-user:founder","authenticated":true},"transport":{"kind":"WINDOWS_NAMED_PIPE"},"startingState":{"projectionEpoch":"epoch_01","projectionSequence":50,"taskRevision":5},"operation":{"executeTaskCommand":{"command":"requestTaskCancellation","commandId":"cmd_cancel_01","requestDigest":"aaaaaaaaaaaaaaaaaaaaaaaaaaaaaaaaaaaaaaaaaaaaaaaaaaaaaaaaaaaaaaaa"}},"expected":{"outcome":"ok","businessWriteCount":1,"writeOwner":"TaskAuthority","authorityCommittedEventId":"task_event_51","projectionAwaitTokenCreated":true,"projectedViewReturnedAsCurrent":false,"localApiFactWritten":false}}
