{"schemaVersion":"v01-localapi-fixture/v0.1","fixtureId":"localapi-valid-get-coherent-task-view","category":"valid","requirementRefs":["C07-PROJECTION-01","AC-08"],"principal":{"kind":"FOUNDER","principalId":"os-user:founder","authenticated":true},"transport":{"kind":"WINDOWS_NAMED_PIPE","peerCredentialVerified":true},"startingState":{"projectionEpoch":"epoch_01","projectionSequence":45,"sourceRevisions":{"task":6,"collaboration":9,"artifact":3,"verification":4,"verdict":2}},"operation":{"getTaskView":{"taskId":"task_01","minimumPosition":{"epoch":"epoch_01","sequence":44}}},"expected":{"outcome":"ok","businessWriteCount":0,"projectionPosition":{"epoch":"epoch_01","sequence":45},"sourceRevisionVectorPreserved":true,"unifiedStatusInvented":false,"taskRevision":6,"workRevision":2}}
