{"schemaVersion":"v01-localapi-fixture/v0.1","fixtureId":"localapi-unauthorized-other-os-user-harness-approval-list","category":"unauthorized","requirementRefs":["G4-08A-AUTH-01","C07-AUTH-01"],"principal":{"kind":"LOCAL_USER","principalId":"os-user:other","authenticated":true},"transport":{"kind":"WINDOWS_NAMED_PIPE","peerCredentialVerified":true},"startingState":{"ownerPrincipalId":"os-user:founder"},"operation":{"listHarnessApprovalViews":{"actionableOnly":true,"pageSize":20}},"expected":{"outcome":"error","businessWriteCount":0,"errorCode":"LOCAL_API_ERROR_CODE_PERMISSION_DENIED","viewsReturned":0}}
