{"schemaVersion":"v01-localapi-fixture/v0.1","fixtureId":"localapi-valid-await-projection-read-your-write","category":"valid","requirementRefs":["C07-CONSISTENCY-01"],"principal":{"kind":"FOUNDER","principalId":"os-user:founder","authenticated":true},"transport":{"kind":"WINDOWS_NAMED_PIPE"},"startingState":{"projectionEpoch":"epoch_01","projectionSequence":50,"requiredEventApplied":true,"requiredTaskRevision":6},"operation":{"awaitProjection":{"token":"await_task_event_51","timeoutMilliseconds":2000}},"expected":{"outcome":"ok","businessWriteCount":0,"projectionPosition":{"epoch":"epoch_01","sequence":51},"taskRevision":6,"minimumSourceRevisionSatisfied":true}}
