{"schemaVersion":"v01-localapi-fixture/v0.1","fixtureId":"localapi-recovery-harness-approval-stream-gap-reset","category":"recovery","requirementRefs":["G4-08A-REC-02","C07-REC-02"],"principal":{"kind":"FOUNDER","principalId":"os-user:founder","authenticated":true},"transport":{"kind":"WINDOWS_NAMED_PIPE"},"startingState":{"currentPosition":{"epoch":"epoch_02","sequence":30},"clientLastPosition":{"epoch":"epoch_01","sequence":82},"retainedFromSequence":10},"operation":{"watchHarnessApprovalViews":{"resumeAfter":{"epoch":"epoch_01","sequence":82}}},"expected":{"outcome":"reset_required","businessWriteCount":0,"frameKind":"STREAM_FRAME_KIND_RESET_REQUIRED","errorCode":"LOCAL_API_ERROR_CODE_PROJECTION_RESET_REQUIRED","clientMustRefetch":true}}
