{"schemaVersion":"v01-localapi-fixture/v0.1","fixtureId":"localapi-unauthorized-system-only-task-command","category":"unauthorized","requirementRefs":["G4-08C-A3"],"principal":{"kind":"FOUNDER","principalId":"os-user:founder","authenticated":true},"transport":{"kind":"WINDOWS_NAMED_PIPE","peerCredentialVerified":true},"startingState":{"grantedPermissionCodes":["local.task.create","local.task.cancellation.request"]},"operation":{"executeTaskCommand":{"oneof":"resume_task","taskId":"task_01","expectedRevision":7}},"expected":{"outcome":"error","businessWriteCount":0,"errorCode":"LOCAL_API_ERROR_CODE_PERMISSION_DENIED","gatewayRejectedBeforeAuthorityCall":true,"authorityCallCount":0,"systemOnlyOneofFailClosed":true}}
