{"schemaVersion":"v01-localapi-fixture/v0.1","fixtureId":"localapi-stale-cursor-old-epoch","category":"stale","requirementRefs":["C07-PAGE-03"],"principal":{"kind":"FOUNDER","principalId":"os-user:founder","authenticated":true},"transport":{"kind":"WINDOWS_NAMED_PIPE"},"startingState":{"currentEpoch":"epoch_02","cursorEpoch":"epoch_01"},"operation":{"listTaskViews":{"pageCursor":"cursor_epoch_01"}},"expected":{"outcome":"reset_required","businessWriteCount":0,"errorCode":"LOCAL_API_ERROR_CODE_PROJECTION_RESET_REQUIRED","newSnapshotRequired":true}}
