{"schemaVersion":"v01-localapi-fixture/v0.1","fixtureId":"localapi-valid-get-harness-approval-policy-state","category":"valid","requirementRefs":["G4-08A-READ-01","C07-READ-04"],"principal":{"kind":"FOUNDER","principalId":"os-user:founder","authenticated":true},"transport":{"kind":"WINDOWS_NAMED_PIPE","peerCredentialVerified":true},"startingState":{"adapterRequest":{"approvalRequestId":"approval-001","requestLifecycle":"APPROVAL_REQUEST_LIFECYCLE_KIND_OPEN","requestRevision":1},"policyDecision":{"authorityDecisionRef":"policy-decision-001","state":"HARNESS_APPROVAL_DECISION_STATE_KIND_ISSUED","stateRevision":1}},"operation":{"getHarnessApprovalView":{"approvalRequestId":"approval-001"}},"expected":{"outcome":"ok","businessWriteCount":0,"adapterRequestSourcePreserved":true,"policyDecisionSourcePreserved":true,"unifiedAuthorityStateInvented":false,"nativeRoutingExposed":false}}
