{"schemaVersion":"v01-localapi-fixture/v0.1","fixtureId":"localapi-valid-evidence-redaction","category":"valid","requirementRefs":["C07-SEC-02"],"principal":{"kind":"LOCAL_USER","principalId":"os-user:founder","authenticated":true},"transport":{"kind":"WINDOWS_NAMED_PIPE"},"startingState":{"artifactVisibility":"restricted","rawPathPresentInSource":true,"secretPresentInSource":true},"operation":{"getEvidenceGraph":{"taskId":"task_01","artifactSetId":"aset_01"}},"expected":{"outcome":"ok","businessWriteCount":0,"redactionMetadataPresent":true,"absolutePathExposed":false,"secretExposed":false,"rawBlobEmbedded":false}}
