{"schemaVersion":"v01-localapi-fixture/v0.1","fixtureId":"localapi-valid-founder-harness-approval-gateway","category":"valid","requirementRefs":["C07-AUTH-03","G4-07A-AUTH-01"],"principal":{"kind":"FOUNDER","principalId":"os-user:founder","authenticated":true},"transport":{"kind":"WINDOWS_NAMED_PIPE","peerCredentialVerified":true},"startingState":{"surface":"CLIENT_SURFACE_DESKTOP","approvalRequestId":"approval-001","approvalObservationSequence":12,"requestRevision":1},"operation":{"decideHarnessApproval":{"approvalRequestId":"approval-001","expectedActionDigestSha256":"e3e3e3e3e3e3e3e3e3e3e3e3e3e3e3e3e3e3e3e3e3e3e3e3e3e3e3e3e3e3e3e3","expectedRequestObservationId":"observation-approval-001","expectedRequestObservationSequence":12,"expectedRequestRevision":1,"decision":"APPROVAL_DECISION_ALLOW_ONCE","reasonCode":"FOUNDER_CONFIRMED"}},"expected":{"outcome":"ok","businessWriteCount":1,"writeOwner":"PolicyDecisionAuthority","policyAuthorityDecisionRefGenerated":true,"adapterCalledDirectly":false,"localApiReinterpretedDecision":false,"projectionAwaitTokenCreated":true}}
