{"schemaVersion":"v01-localapi-fixture/v0.1","fixtureId":"localapi-valid-open-desktop-session","category":"valid","requirementRefs":["C07-AUTH-01","G4-08C-A1","G4-08C-A3","M-08","M13-CONTRACT","R9A.2-CONTRACT","R9C-D06","ADR-0004","ADR-0005"],"principal":{"kind":"FOUNDER","principalId":"os-user:founder","authenticated":true},"transport":{"kind":"WINDOWS_NAMED_PIPE","peerCredentialVerified":true,"aclCurrentUserOnly":true},"startingState":{"projectionEpoch":"epoch_01","projectionSequence":40},"operation":{"openSession":{"clientInstanceId":"desktop_01","surface":"CLIENT_SURFACE_DESKTOP","supportedContractVersions":["0.1.0-draft.24"]}},"expected":{"outcome":"ok","businessWriteCount":0,"sessionCreated":true,"authenticatedPrincipalFromTransport":true,"surfaceUsedAsAuthorization":false,"negotiatedContractVersion":"0.1.0-draft.24","clientKernelContractId":"egopulse.client-kernel.v1","clientKernelContractVersion":"0.1.0","clientKernelDigestMatchesProfile":true,"authorizationPolicyContractId":"egopulse.authorization.v1","authorizationPolicyContractVersion":"0.1.0","authorizationPolicyDigestMatchesProfile":true,"grantedPermissionCodesKnownToProfile":true,"grantedWriteCapabilities":["local.task.create","local.task.cancellation.request","local.memory.candidate.submit","local.memory.govern","local.context.revoke","local.work-capability.default.set","local.work.prepare","local.work.confirm","local.approval.decide","local.founder-verdict.issue","local.founder-verdict.revoke","local.founder-verdict.apply"],"grantedReadCapabilities":["local.memory.retrieve","local.harness.content.read","local.work-capability.read"]}}
