{"schemaVersion":"v01-localapi-fixture/v0.1","fixtureId":"localapi-valid-list-stable-cursor","category":"valid","requirementRefs":["C07-PAGE-01"],"principal":{"kind":"FOUNDER","principalId":"os-user:founder","authenticated":true},"transport":{"kind":"WINDOWS_NAMED_PIPE"},"startingState":{"projectionEpoch":"epoch_01","projectionSequence":50},"operation":{"listTaskViews":{"statusFilter":["TASK_STATUS_ACTIVE"],"pageSize":20,"sort":"updated_at_desc_task_id_asc"}},"expected":{"outcome":"ok","businessWriteCount":0,"snapshotPosition":{"epoch":"epoch_01","sequence":50},"cursorBindsFilterSortAndPosition":true,"stableTieBreaker":"task_id","pageSizeClamped":true}}
