{"schemaVersion":"v01-localapi-fixture/v0.1","fixtureId":"localapi-recovery-projector-rebuild-new-epoch","category":"recovery","requirementRefs":["C07-REC-03","C08-INPUT"],"principal":{"kind":"LOCAL_USER","principalId":"os-user:founder","authenticated":true},"transport":{"kind":"WINDOWS_NAMED_PIPE"},"startingState":{"oldEpoch":"epoch_01","newEpoch":"epoch_02","projectionRebuiltFromAuthorityEvents":true,"sourceFactsMutated":false},"operation":{"watchTaskViews":{"resumeAfter":{"epoch":"epoch_01","sequence":90}}},"expected":{"outcome":"reset_required","businessWriteCount":0,"frameKind":"STREAM_FRAME_KIND_RESET_REQUIRED","newEpoch":"epoch_02","oldCursorRejected":true,"authorityBusinessWriteCount":0}}
