{"schemaVersion":"v01-localapi-fixture/v0.1","fixtureId":"localapi-valid-watch-complete-snapshots","category":"valid","requirementRefs":["C07-STREAM-01"],"principal":{"kind":"FOUNDER","principalId":"os-user:founder","authenticated":true},"transport":{"kind":"WINDOWS_NAMED_PIPE"},"startingState":{"projectionEpoch":"epoch_01","projectionSequence":51},"operation":{"watchTaskViews":{"resumeAfter":{"epoch":"epoch_01","sequence":51},"taskIds":["task_01"]}},"expected":{"outcome":"ok","businessWriteCount":0,"frameKind":"STREAM_FRAME_KIND_SNAPSHOT","completeSnapshot":true,"fieldPatch":false,"delivery":"at_least_once","orderedWithinEpoch":true}}
