{"schemaVersion":"v01-localapi-fixture/v0.1","fixtureId":"localapi-duplicate-stream-frame-deduped","category":"duplicate","requirementRefs":["C07-STREAM-03"],"principal":{"kind":"LOCAL_USER","principalId":"os-user:founder","authenticated":true},"transport":{"kind":"WINDOWS_NAMED_PIPE"},"startingState":{"lastAppliedPosition":{"epoch":"epoch_01","sequence":62}},"operation":{"watchTaskViews":{"receivedPosition":{"epoch":"epoch_01","sequence":62}}},"expected":{"outcome":"replayed","businessWriteCount":0,"replayed":true,"clientAppliesSnapshot":false,"refetchRequired":false}}
